{
  "schemaVersion": 1,
  "id": "bulletin-2026-06-07",
  "revision": 0,
  "template": {
    "id": "lamb-of-god-example",
    "version": 1
  },
  "church": {
    "name": "Lamb of God Lutheran Church"
  },
  "info": {
    "title": "God Loves Sinners",
    "series": "Say It Out Loud",
    "date": "2026-06-07",
    "churchWeek": "Second Sunday After Pentecost"
  },
  "blocks": [
    {
      "id": "titlepage",
      "type": "titlePage",
      "seriesAsset": {
        "path": "assets/sermon_series/say_it_out_loud/logo.png",
        "mediaType": "image/png",
        "alt": "Say It Out Loud"
      },
      "churchLogoAsset": {
        "path": "assets/church/logo.png",
        "mediaType": "image/png",
        "alt": "Lamb of God Lutheran Church"
      },
      "weeklyEditable": true
    },
    {
      "id": "god-loves-sinners",
      "type": "sermonTitle",
      "text": "God Loves Sinners",
      "weeklyEditable": true
    },
    {
      "id": "the-gathering",
      "type": "sectionHeading",
      "text": "The Gathering"
    },
    {
      "id": "opening-hymn",
      "type": "song",
      "label": "Opening Hymn",
      "title": "To God Be the Glory (CW 399)",
      "songType": "hymn",
      "libraryItemId": "cw399",
      "selection": {
        "mode": "verses",
        "verses": [
          1,
          2,
          3
        ]
      },
      "renderMode": "lyrics",
      "weeklyEditable": true,
      "contentOverride": [
        {
          "type": "paragraph",
          "children": [
            {
              "type": "text",
              "text": "1.      To God be the glory; great things he has done!\nHe so loved the world that he gave us his Son,\nWho yielded his life an atonement for sin\nAnd opened the life-gate that all may go in.\nPraise the Lord! Praise the Lord! Let the earth hear his voice!\nPraise the Lord! Praise the Lord! Let the people rejoice!\nOh, come to the Father through Jesus the Son\nAnd give him the glory -- great things he has done!"
            }
          ]
        },
        {
          "type": "paragraph",
          "children": [
            {
              "type": "text",
              "text": "2.      Oh, perfect redemption, the purchase of blood,\nTo ev'ry believer the promise of God;\nThe vilest offender who truly believes,\nThat moment from Jesus a pardon receives.\nPraise the Lord! Praise the Lord! Let the earth hear his voice!\nPraise the Lord! Praise the Lord! Let the people rejoice!\nOh, come to the Father through Jesus the Son\nAnd give him the glory -- great things he has done!"
            }
          ]
        },
        {
          "type": "paragraph",
          "children": [
            {
              "type": "text",
              "text": "3.     Great things he has taught us, great things he has done,\nAnd great our rejoicing through Jesus the Son,\nBut purer and higher and greater will be\nOur joy and our wonder when Jesus we see.\nPraise the Lord! Praise the Lord! Let the earth hear his voice!\nPraise the Lord! Praise the Lord! Let the people rejoice!\nOh, come to the Father through Jesus the Son\nAnd give him the glory -- great things he has done!"
            }
          ]
        }
      ]
    },
    {
      "id": "invocation",
      "type": "heading",
      "text": "Invocation"
    },
    {
      "id": "responsivereading",
      "type": "responsiveReading",
      "entries": [
        {
          "reader": "M",
          "content": [
            {
              "type": "paragraph",
              "children": [
                {
                  "type": "text",
                  "text": "Blessed be the holy Trinity, "
                },
                {
                  "type": "symbol",
                  "name": "cross"
                },
                {
                  "type": "text",
                  "text": " one God, who forgives all our sin, whose mercy endures forever."
                }
              ]
            }
          ]
        },
        {
          "reader": "C",
          "content": [
            {
              "type": "paragraph",
              "children": [
                {
                  "type": "text",
                  "text": "Amen."
                }
              ]
            }
          ]
        }
      ]
    },
    {
      "id": "prayer",
      "type": "heading",
      "text": "Prayer"
    },
    {
      "id": "responsivereading-2",
      "type": "responsiveReading",
      "entries": [
        {
          "reader": "M",
          "content": [
            {
              "type": "paragraph",
              "children": [
                {
                  "type": "text",
                  "text": "Almighty God, to whom all hearts are open, all desires known, and from whom no secrets are hidden; cleanse the thoughts of our hearts by the inspiration of your Holy Spirit, that we may perfectly love you and worthily magnify your holy name, through Jesus Christ our Lord."
                }
              ]
            }
          ]
        },
        {
          "reader": "C",
          "content": [
            {
              "type": "paragraph",
              "children": [
                {
                  "type": "text",
                  "text": "Amen."
                }
              ]
            }
          ]
        }
      ]
    },
    {
      "id": "confession-of-sins",
      "type": "heading",
      "text": "Confession of Sins"
    },
    {
      "id": "responsivereading-3",
      "type": "responsiveReading",
      "entries": [
        {
          "reader": "M",
          "content": [
            {
              "type": "paragraph",
              "children": [
                {
                  "type": "text",
                  "text": "If we say we have no sin, we deceive ourselves, and the truth is not in us. But if we confess our sins, God who is faithful and just will forgive our sins and cleanse us from all unrighteousness."
                }
              ]
            },
            {
              "type": "paragraph",
              "align": "right",
              "children": [
                {
                  "type": "text",
                  "text": "1 John 1:8-9",
                  "marks": [
                    "italic"
                  ]
                }
              ]
            },
            {
              "type": "paragraph",
              "children": [
                {
                  "type": "text",
                  "text": "Holy God, holy and mighty, holy and immortal, have mercy on us. For self-centered living, and for failing to walk with humility and gentleness:"
                }
              ]
            }
          ]
        },
        {
          "reader": "C",
          "content": [
            {
              "type": "paragraph",
              "children": [
                {
                  "type": "text",
                  "text": "Holy God, holy and mighty, holy and immortal, have mercy on us."
                }
              ]
            }
          ]
        },
        {
          "reader": "M",
          "content": [
            {
              "type": "paragraph",
              "children": [
                {
                  "type": "text",
                  "text": "For longing to have what is not ours, and for failing to give thanks for what is ours:"
                }
              ]
            }
          ]
        },
        {
          "reader": "C",
          "content": [
            {
              "type": "paragraph",
              "children": [
                {
                  "type": "text",
                  "text": "Holy God, holy and mighty, holy and immortal, have mercy on us."
                }
              ]
            }
          ]
        },
        {
          "reader": "M",
          "content": [
            {
              "type": "paragraph",
              "children": [
                {
                  "type": "text",
                  "text": "For angry deeds, for hurtful words, for uncharitable thoughts, and for those sins we do not even remember committing:"
                }
              ]
            }
          ]
        },
        {
          "reader": "C",
          "content": [
            {
              "type": "paragraph",
              "children": [
                {
                  "type": "text",
                  "text": "Holy God, holy and mighty, holy and immortal, have mercy on us."
                }
              ]
            }
          ]
        },
        {
          "reader": "M",
          "content": [
            {
              "type": "paragraph",
              "children": [
                {
                  "type": "text",
                  "text": "For idleness in witnessing for Jesus Christ, and for squandering the gifts of love and grace:"
                }
              ]
            }
          ]
        },
        {
          "reader": "C",
          "content": [
            {
              "type": "paragraph",
              "children": [
                {
                  "type": "text",
                  "text": "Holy God, holy and mighty, holy and immortal, have mercy on us."
                }
              ]
            }
          ]
        },
        {
          "reader": "M",
          "content": [
            {
              "type": "paragraph",
              "children": [
                {
                  "type": "text",
                  "text": "For all the wrong we have done, and all the good we have failed to do:"
                }
              ]
            }
          ]
        },
        {
          "reader": "C",
          "content": [
            {
              "type": "paragraph",
              "children": [
                {
                  "type": "text",
                  "text": "Holy God, holy and mighty, holy and immortal, have mercy on us."
                }
              ]
            }
          ]
        },
        {
          "reader": "M",